{
  "format_version": 1,
  "rest_o_matic_version": "v0.2.0",
  "valid": false,
  "problems": [
    {
      "severity": "error",
      "message": "reading config missing.yaml: open missing.yaml: no such file or directory",
      "job": null,
      "repository": null,
      "path": null,
      "line": null,
      "column": null
    }
  ]
}
